{
  "schema_version": 1,
  "source": "arm",
  "region": "uksouth",
  "observed_at": "2026-10-31T07:30:00Z",
  "previous_run_at": "2026-10-31T01:30:00Z",
  "runs_since_previous_file": 0,
  "previous_file": "observations/arm/uksouth/2026/10/2026-10-31T01-30-00Z.json",
  "checkpoint": "checkpoints/arm/uksouth/2026-10-27T19-30-00Z.json",
  "observed_from": "standard pay-as-you-go and Visual Studio Enterprise subscriptions",
  "entry_count": 116,
  "cell_count": 189,
  "snapshot_sha256": "1caee825023d1529ef66be9f97a0357f6d5190e824505c484bffc65d4d153437",
  "keys_present": [
    "Codestral-2501@2",
    "Cohere-Embed-V5-Fast@1",
    "Cohere-Embed-V5-Pro@1",
    "Cohere-command-a-plus-05-2026@1",
    "Cohere-embed-v3-english@1",
    "Cohere-embed-v3-multilingual@1",
    "Cohere-parse-v5@1",
    "Cohere-rerank-v4.0-fast@1",
    "Cohere-rerank-v4.0-pro@1",
    "Cohere-rerank-v5-fast@1",
    "Cohere-rerank-v5-pro@1",
    "DeepSeek-R1@1",
    "DeepSeek-V3.2-Speciale@1",
    "DeepSeek-V3.2@1",
    "DeepSeek-V4-Flash-0731@2026-07-31",
    "DeepSeek-V4-Flash@2026-04-23",
    "DeepSeek-V4-Pro@2026-04-23",
    "DeepSeek-V4.1-Flash@2026-09-10",
    "FLUX-1.1-pro@1",
    "FLUX.1-Kontext-pro@1",
    "FLUX.2-flex@1",
    "FLUX.2-pro@1",
    "Kimi-K2.5@1",
    "Kimi-K2.6@2026-04-20",
    "Kimi-K2.7-Code@2026-06-12",
    "Llama-3.3-70B-Instruct@1",
    "Llama-3.3-70B-Instruct@2",
    "Llama-3.3-70B-Instruct@3",
    "Llama-3.3-70B-Instruct@4",
    "Llama-3.3-70B-Instruct@5",
    "Llama-3.3-70B-Instruct@9",
    "Llama-4-Maverick-17B-128E-Instruct-FP8@1",
    "Llama-4-Scout-17B-16E-Instruct@1",
    "MAI-Code-1.1-Flash@2026-09-15",
    "MAI-Thinking-1@2026-06-01",
    "Microsoft-Decision-1@1",
    "Ministral-3B@1",
    "Mistral-Large-3@1",
    "Mistral-large@1",
    "Muse-Glimmer-30B@1",
    "Phi-4-mini-instruct@1",
    "Phi-4-mini-reasoning@1",
    "Phi-4-multimodal-instruct@1",
    "Phi-4-reasoning@1",
    "Phi-4@2",
    "Phi-4@3",
    "Phi-4@4",
    "Phi-4@5",
    "Phi-4@6",
    "Phi-4@7",
    "cohere-command-a@1",
    "embed-v-4-0@1",
    "gpt-4.1-mini@2025-04-14",
    "gpt-4.1-nano@2025-04-14",
    "gpt-4.1@2025-04-14",
    "gpt-4o-mini@2024-07-18",
    "gpt-4o@2024-05-13",
    "gpt-4o@2024-08-06",
    "gpt-4o@2024-11-20",
    "gpt-5-codex@2025-09-15",
    "gpt-5-mini@2025-08-07",
    "gpt-5-nano@2025-08-07",
    "gpt-5-pro@2025-10-06",
    "gpt-5.1-codex-max@2025-12-04",
    "gpt-5.1-codex-mini@2025-11-13",
    "gpt-5.1-codex@2025-11-13",
    "gpt-5.1@2025-11-13",
    "gpt-5.2-codex@2026-01-14",
    "gpt-5.2@2025-12-11",
    "gpt-5.3-codex@2026-02-24",
    "gpt-5.4-mini@2026-03-17",
    "gpt-5.4-nano@2026-03-17",
    "gpt-5.4-pro@2026-03-05",
    "gpt-5.4@2026-03-05",
    "gpt-5.5@2026-04-24",
    "gpt-5.6-luna@2026-07-09",
    "gpt-5.6-sol@2026-07-09",
    "gpt-5.6-terra@2026-07-09",
    "gpt-5@2025-08-07",
    "gpt-6-astra@2026-09-03",
    "gpt-6-luna@2026-09-22",
    "gpt-6-sol@2026-09-22",
    "gpt-6.1-sol@2026-09-29",
    "gpt-6.1-terra@2026-10-26",
    "gpt-chat-latest@2026-05-05",
    "gpt-chat-latest@2026-08-06",
    "gpt-chat-latest@2026-10-07",
    "gpt-oss-120b@1",
    "gpt-oss-20b@11",
    "grok-4-1-fast-non-reasoning@1",
    "grok-4-1-fast-reasoning@1",
    "grok-4-20-non-reasoning@1",
    "grok-4-20-reasoning@1",
    "grok-4.3@1",
    "grok-4.6@1",
    "grok-4.7@1",
    "mistral-document-ai-2512@1",
    "mistral-medium-2505@1",
    "mistral-medium-3-5@1",
    "mistral-ocr-4-0@1",
    "mistral-small-2503@1",
    "model-router@2025-05-19",
    "model-router@2025-08-07",
    "model-router@2025-11-18",
    "muse-spark-1.3@1",
    "o1@2024-12-17",
    "o3-mini@2025-01-31",
    "o3@2025-04-16",
    "o4-mini@2025-04-16",
    "qwen3-32b@1",
    "qwen3.6-35b-a3b@1",
    "qwen3.8-27b@1",
    "text-embedding-3-large@1",
    "text-embedding-3-small@1",
    "text-embedding-ada-002@2",
    "whisper@001"
  ],
  "changes": [
    {
      "kind": "deprecation_moved",
      "model_key": "Cohere-rerank-v4.0-fast@1",
      "window_start": "2026-10-31T01:30:00Z",
      "window_end": "2026-10-31T07:30:00Z",
      "fields": [
        "deprecation_inference",
        "skus[GlobalStandard].deprecation_date"
      ],
      "before": {
        "name": "Cohere-rerank-v4.0-fast",
        "skus": [
          {
            "name": "GlobalStandard",
            "deprecation_date": "2099-12-31T00:00:00Z"
          }
        ],
        "format": "Cohere",
        "version": "1",
        "capabilities": {
          "chatCompletion": "true"
        },
        "lifecycle_portal": "Generally Available",
        "lifecycle_status": "GenerallyAvailable",
        "is_default_version": true,
        "deprecation_fine_tune": null,
        "deprecation_inference": "2099-12-31T00:00:00Z"
      },
      "after": {
        "name": "Cohere-rerank-v4.0-fast",
        "version": "1",
        "format": "Cohere",
        "lifecycle_status": "GenerallyAvailable",
        "lifecycle_portal": "Generally Available",
        "deprecation_inference": "2027-09-13T00:00:00Z",
        "deprecation_fine_tune": null,
        "is_default_version": true,
        "capabilities": {
          "chatCompletion": "true"
        },
        "skus": [
          {
            "name": "GlobalStandard",
            "deprecation_date": "2027-09-13T00:00:00Z"
          }
        ]
      }
    },
    {
      "kind": "deprecation_moved",
      "model_key": "Cohere-rerank-v4.0-pro@1",
      "window_start": "2026-10-31T01:30:00Z",
      "window_end": "2026-10-31T07:30:00Z",
      "fields": [
        "deprecation_inference",
        "skus[GlobalStandard].deprecation_date"
      ],
      "before": {
        "name": "Cohere-rerank-v4.0-pro",
        "skus": [
          {
            "name": "GlobalStandard",
            "deprecation_date": "2099-12-31T00:00:00Z"
          }
        ],
        "format": "Cohere",
        "version": "1",
        "capabilities": {
          "chatCompletion": "true"
        },
        "lifecycle_portal": "Generally Available",
        "lifecycle_status": "GenerallyAvailable",
        "is_default_version": true,
        "deprecation_fine_tune": null,
        "deprecation_inference": "2099-12-31T00:00:00Z"
      },
      "after": {
        "name": "Cohere-rerank-v4.0-pro",
        "version": "1",
        "format": "Cohere",
        "lifecycle_status": "GenerallyAvailable",
        "lifecycle_portal": "Generally Available",
        "deprecation_inference": "2027-09-13T00:00:00Z",
        "deprecation_fine_tune": null,
        "is_default_version": true,
        "capabilities": {
          "chatCompletion": "true"
        },
        "skus": [
          {
            "name": "GlobalStandard",
            "deprecation_date": "2027-09-13T00:00:00Z"
          }
        ]
      }
    },
    {
      "kind": "deprecation_moved",
      "model_key": "DeepSeek-V3.2-Speciale@1",
      "window_start": "2026-10-31T01:30:00Z",
      "window_end": "2026-10-31T07:30:00Z",
      "fields": [
        "deprecation_inference",
        "skus[GlobalStandard].deprecation_date"
      ],
      "before": {
        "name": "DeepSeek-V3.2-Speciale",
        "skus": [
          {
            "name": "GlobalStandard",
            "deprecation_date": "2099-12-31T00:00:00Z"
          }
        ],
        "format": "DeepSeek",
        "version": "1",
        "capabilities": {
          "agentsV2": "true",
          "chatCompletion": "true"
        },
        "lifecycle_portal": "Generally Available",
        "lifecycle_status": "GenerallyAvailable",
        "is_default_version": true,
        "deprecation_fine_tune": null,
        "deprecation_inference": "2099-12-31T00:00:00Z"
      },
      "after": {
        "name": "DeepSeek-V3.2-Speciale",
        "version": "1",
        "format": "DeepSeek",
        "lifecycle_status": "GenerallyAvailable",
        "lifecycle_portal": "Generally Available",
        "deprecation_inference": "2027-11-01T00:00:00Z",
        "deprecation_fine_tune": null,
        "is_default_version": true,
        "capabilities": {
          "agentsV2": "true",
          "chatCompletion": "true"
        },
        "skus": [
          {
            "name": "GlobalStandard",
            "deprecation_date": "2027-11-01T00:00:00Z"
          }
        ]
      }
    }
  ]
}
