{
  "schema_version": 1,
  "source": "arm",
  "region": "uaenorth",
  "observed_at": "2026-10-28T01:30:00Z",
  "previous_run_at": "2026-10-27T19:30:00Z",
  "runs_since_previous_file": 0,
  "previous_file": null,
  "checkpoint": "checkpoints/arm/uaenorth/2026-10-27T19-30-00Z.json",
  "observed_from": "standard pay-as-you-go subscription",
  "entry_count": 143,
  "cell_count": 195,
  "snapshot_sha256": "34cb243f6f149f49bfae874fd008d0ad846caadf86bfde1b00ea0ddbf48b80aa",
  "keys_present": [
    "Codestral-2501@2",
    "Cohere-Embed-V5-Fast@1",
    "Cohere-Embed-V5-Pro@1",
    "Cohere-command-a-plus-05-2026@1",
    "Cohere-embed-v3-english@1",
    "Cohere-embed-v3-multilingual@1",
    "Cohere-parse-v5@1",
    "Cohere-rerank-v4.0-fast@1",
    "Cohere-rerank-v4.0-pro@1",
    "Cohere-rerank-v5-fast@1",
    "Cohere-rerank-v5-pro@1",
    "DeepSeek-R1@1",
    "DeepSeek-V3.2-Speciale@1",
    "DeepSeek-V3.2@1",
    "DeepSeek-V4-Flash-0731@2026-07-31",
    "DeepSeek-V4-Flash@2026-04-23",
    "DeepSeek-V4-Pro@2026-04-23",
    "DeepSeek-V4.1-Flash@2026-09-10",
    "FLUX-1.1-pro@1",
    "FLUX.1-Kontext-pro@1",
    "FLUX.2-flex@1",
    "FLUX.2-pro@1",
    "Kimi-K2.5@1",
    "Kimi-K2.6@2026-04-20",
    "Kimi-K2.7-Code@2026-06-12",
    "Llama-3.3-70B-Instruct@1",
    "Llama-3.3-70B-Instruct@2",
    "Llama-3.3-70B-Instruct@3",
    "Llama-3.3-70B-Instruct@4",
    "Llama-3.3-70B-Instruct@5",
    "Llama-3.3-70B-Instruct@9",
    "Llama-4-Maverick-17B-128E-Instruct-FP8@1",
    "Llama-4-Scout-17B-16E-Instruct@1",
    "MAI-Image-2.5-Flash@2026-06-02",
    "MAI-Image-2.5-Pro@2026-06-19",
    "MAI-Image-2.5@2026-06-02",
    "MAI-Image-2.6-Flash@2026-07-31",
    "MAI-Image-2.6@2026-07-31",
    "MAI-Image-2@2026-02-20",
    "MAI-Image-2e@2026-04-09",
    "MAI-Thinking-1@2026-06-01",
    "Microsoft-Decision-1@1",
    "Ministral-3B@1",
    "Mistral-Large-3@1",
    "Mistral-large@1",
    "Muse-Glimmer-30B@1",
    "Phi-4-mini-instruct@1",
    "Phi-4-mini-reasoning@1",
    "Phi-4-multimodal-instruct@1",
    "Phi-4-reasoning@1",
    "Phi-4@2",
    "Phi-4@3",
    "Phi-4@4",
    "Phi-4@5",
    "Phi-4@6",
    "Phi-4@7",
    "cohere-command-a@1",
    "embed-v-4-0@1",
    "gpt-4.1-mini@2025-04-14",
    "gpt-4.1-nano@2025-04-14",
    "gpt-4.1@2025-04-14",
    "gpt-4o-mini-transcribe@2025-03-20",
    "gpt-4o-mini-transcribe@2025-12-15",
    "gpt-4o-mini@2024-07-18",
    "gpt-4o-transcribe-diarize@2025-10-15",
    "gpt-4o-transcribe@2025-03-20",
    "gpt-4o@2024-05-13",
    "gpt-4o@2024-08-06",
    "gpt-4o@2024-11-20",
    "gpt-5-codex@2025-09-15",
    "gpt-5-mini@2025-08-07",
    "gpt-5-nano@2025-08-07",
    "gpt-5-pro@2025-10-06",
    "gpt-5.1-codex-max@2025-12-04",
    "gpt-5.1-codex-mini@2025-11-13",
    "gpt-5.1-codex@2025-11-13",
    "gpt-5.1@2025-11-13",
    "gpt-5.2-codex@2026-01-14",
    "gpt-5.2@2025-12-11",
    "gpt-5.3-codex@2026-02-24",
    "gpt-5.4-mini@2026-03-17",
    "gpt-5.4-nano@2026-03-17",
    "gpt-5.4-pro@2026-03-05",
    "gpt-5.4@2026-03-05",
    "gpt-5.5@2026-04-24",
    "gpt-5.6-luna@2026-07-09",
    "gpt-5.6-sol@2026-07-09",
    "gpt-5.6-terra@2026-07-09",
    "gpt-5@2025-08-07",
    "gpt-6-astra@2026-09-03",
    "gpt-6-luna@2026-09-22",
    "gpt-6-sol@2026-09-22",
    "gpt-6.1-sol@2026-09-29",
    "gpt-6.1-terra@2026-10-26",
    "gpt-chat-latest@2026-05-05",
    "gpt-chat-latest@2026-08-06",
    "gpt-chat-latest@2026-10-07",
    "gpt-image-1-mini@2025-10-06",
    "gpt-image-1.5@2025-12-16",
    "gpt-image-1@2025-04-15",
    "gpt-image-2.5-flare@2026-09-08",
    "gpt-image-2.5-sunburst@2026-09-08",
    "gpt-image-2@2026-04-21",
    "gpt-live-1@2026-09-10",
    "gpt-live-transcribe@2026-07-28",
    "gpt-oss-120b@1",
    "gpt-oss-20b@11",
    "gpt-realtime-1.5@2026-02-23",
    "gpt-realtime-2.1-mini@2026-07-07",
    "gpt-realtime-2.1@2026-07-07",
    "gpt-realtime-2@2026-05-06",
    "gpt-realtime-mini@2025-10-06",
    "gpt-realtime-mini@2025-12-15",
    "gpt-realtime-translate@2026-05-06",
    "gpt-realtime-whisper@2026-05-06",
    "gpt-realtime@2025-08-28",
    "gpt-transcribe@2026-07-28",
    "grok-4-1-fast-non-reasoning@1",
    "grok-4-1-fast-reasoning@1",
    "grok-4-20-non-reasoning@1",
    "grok-4-20-reasoning@1",
    "grok-4.3@1",
    "grok-4.6@1",
    "grok-4.7@1",
    "mistral-document-ai-2512@1",
    "mistral-medium-2505@1",
    "mistral-medium-3-5@1",
    "mistral-ocr-4-0@1",
    "mistral-small-2503@1",
    "model-router@2025-05-19",
    "model-router@2025-08-07",
    "model-router@2025-11-18",
    "o1@2024-12-17",
    "o3-mini@2025-01-31",
    "o3@2025-04-16",
    "o4-mini@2025-04-16",
    "qwen3-32b@1",
    "qwen3.6-35b-a3b@1",
    "qwen3.8-27b@1",
    "text-embedding-3-large@1",
    "text-embedding-3-small@1",
    "text-embedding-ada-002@2",
    "whisper@001"
  ],
  "changes": [
    {
      "kind": "lifecycle_changed",
      "model_key": "gpt-image-1@2025-04-15",
      "window_start": "2026-10-27T19:30:00Z",
      "window_end": "2026-10-28T01:30:00Z",
      "fields": [
        "lifecycle_portal"
      ],
      "before": {
        "name": "gpt-image-1",
        "skus": [
          {
            "name": "GlobalStandard",
            "deprecation_date": "2026-10-28T00:00:00Z"
          }
        ],
        "format": "OpenAI",
        "version": "2025-04-15",
        "capabilities": {
          "inference": "true",
          "imageEdits": "true",
          "imageGenerations": "true"
        },
        "lifecycle_portal": "Preview",
        "lifecycle_status": "Preview",
        "is_default_version": true,
        "deprecation_fine_tune": null,
        "deprecation_inference": "2026-10-28T00:00:00Z"
      },
      "after": {
        "name": "gpt-image-1",
        "version": "2025-04-15",
        "format": "OpenAI",
        "lifecycle_status": "Preview",
        "lifecycle_portal": "Retired",
        "deprecation_inference": "2026-10-28T00:00:00Z",
        "deprecation_fine_tune": null,
        "is_default_version": true,
        "capabilities": {
          "imageEdits": "true",
          "imageGenerations": "true",
          "inference": "true"
        },
        "skus": [
          {
            "name": "GlobalStandard",
            "deprecation_date": "2026-10-28T00:00:00Z"
          }
        ]
      }
    }
  ]
}
